,Clean_Text
1909,school threw duster child hit head blow caused flesh wound afraid happen teacher found circumstances
1910,Finding subordinate work willing cooperate discussions try resolve attitude problem
1911,Death family dog
1912,friends dinner threw beer bottle air bounced expensive table damaged table The person apologise
1913,making joke friends marriage personal
1914,Carried vandalistic act windows old army location
1915,Arriving New Zealand teenager  overseas trip  \exhilarating\ change scenery etc
1916,child (ie 57) hiking reasonably rugged bush lost duration 57 hours
1917,Following argument brother broke golf clubs
1918,Leaving house female friend shared 68 months friendship developed approach occasional instances personal crises
1919,Discovering good friend lied me resulting detrimental relationship person
1920,specific instances  lied child resulting blamed event
1921,Leaving University 1982 following exclusion lying parents/friends reasons leaving ie lying fact excluded
1922,Going friends wedding seeing old friends known moved new district years previously
1923,Car accident Travelling passenger narrow bitumen road night  trying overtake semitrailer truck pulled hit wet dirt swerved truck verge guide post ditch
1924,school shouting argument friend ability carry particular duty correct way harming her
1925,Looking endofsemester results finding Id failed seven (subjects)
1926,found family friends embezzelling company worked  company petrol food supplies claiming furniture crockery
1927,best friend foud Id lying Id back
1928,told authority figure large lie told believed me believed lied her
1929,away holiday 2 months friend lived interstate remembered Id phoned welcome home night arrival
1930,Walking dog barking following you
1931,group assignment left work blame mistakes
1932,training Australian championship competition year injuring 2 weeks competiotion
1933,ruining someones property fun it
1934,friend giving expensive Christmas gift gave cheap one
1935,Talking back
1936,captain school swimming team team points relay relay swam in team championship
1937,Grade 7 came home school day told mother skin cancer hospital straight away
1938,Brother provoked anger mother father away look ourselves accused selfish snob
1939,Shifted Melbourne Brisbane old school friends gave party goodbye all
1940,picking father work passing Valley watched prostitutes walk waiting pick up Clothing disgusting
1941,good friend grew apart found running friends
1942,Guilt fighting sister (for) telling bad was
1943,\Under 18\ Showjumping Brookfield Show competition stiff riders competing
1944,holiday walking staying night men started closely following me run to
1945,mother father split angry: felt deprived \different\ children school
1946,terribly upset kitten got hit car die weeks thought down
1947,heard good friends party got involved undesirable characters experimenting drugs
1948,studied exam pretended sick school lied mother  realized lying got home work found friends place
1949,young stole money mothers purse much remember found gone felt guilty
1950,Day received TE score acceptance chosen course
1951,day University (I know expect)
1952,school dance supposed \best friend\ kept walking away came near her
1953,end school  function \celebrate\  Leaving friends Id known 12 years
1954,watching film experimental operation cats brain cat metal pieces protruding eyes mouth etc head stable cut open
1955,mother asked job require effort part refused selfish reasons saw it
1956,told car took felt guilty taken it
1957,Eating biscuits drinking Milo (Chocolate energy drink milk usually drunk warm) friend College well withold feelings others friends pretty good cheering homesick
1958,Going disco wait friends separated planned meet sure going place felt conscious alone
1959,person ignored advice pay attention saying acted there group work everybody right speak ignored me feel insignificant
1960,friend psychiatric problems mothers death ages ago quiet relates childhood feel sadness him lead normal life unfair
1961,school thing people age think getting rolling drunk good time firstly getting drunk
1962,girl yelled group guys knew sounded childish
1963,tell parents exacly late getting home night left details somehow felt lied them
1964,Getting good mark subject worked hard expected moderate mark
1965,cleaning pile junk house huge spider (a \Jungle Spider\) ran near me (I like small spiders)
1966,hardware store trying convert Imperial Metric measurements mistake buy tiles bathroom angry myself hope Maths teacher
1967,father died year 8week severe illness
1968,PY 102 film session Tuesday films shown experiment live cat involving strapping machine possibly days things brain
1969,years ago caught riding train ticket stationmistress treated like criminal almost
1970,walking quickly unthinking childrens playground toddler ran knocked hit head hard began crying
1971,got good reaction tutor tutorial group presentation Id given worried about
1972,man yelling outside window 300 am yelling threats me
1973,Going away weekend leaving College room open  returned friends party there leaving mess
1974,Passing away father
1975,party boys telling revolting stories girls theyd with
1976,Getting slightly intoxicated 1984 ICC Ball
1977,felt guilty going studying presentation Wednesday week
1978,received results final examination  Higher School Certificate  received mark wildest expectations
1979,Walking University night myself previously warned rapes etc
1980,received mark requirements course wanted enter accepted  anger injustice it receive early release HSC marks
1981,left friends school (break up) knowing probably separate ways long time
1982,father yelled accused sisters friend (over phone) do know about
1983,little placing lolly varnish pulled admit guilt
1984,felt guilty skipped hour practical class knew miss information know cope going
1985,Got semester University
1986,tender age friend left party proceeded walk dark secluded streets bad neighborhood find telephone (recent spate Horror Movie watching occurred)
1987,situation friends actions deliberately wishes (with) regard feelings
1988,broke boyfriend seven months \indepth\ relationship feelings grief loss felt immense sadness
1989,situation ignored beliefs principles trip whimsy
1990,bacame involved boy brief moment liked needed sort company consequences expected caused shame
1991,Ignoring parentswishes
1992,Getting boyfriend year away  apart
1993,luggage checked Customs
1994,friend speak tell why
1995,Thinking friends overseas
1996,Hearing filthy situation phone
1997,Sending pictures home Id weight
1998,Borrowed elses towel asking
1999,opened TE Score envelope saw got Physiotherapy
2000,bringing shopping nearly stood snake
2001,accused \bitching\ best friend
2002,Senior dinner  separated school friends again
2003,night club watching little tarts trying earn living
2004,little  Mum caught telling lie broke cup
2005,tell Mum going (going)
2006,brothers passed exams able graduate courses
2007,caught elevator got stuck floors
2008,tennis team standard
2009,father died
2010,seen people drunk making fools themselves
2011,friends rude girl
2012,rude mother got angry her
2013,present boyfriend asked initially waited long time occur
2014,somebody broke home night mother out sister gone bed
2015,sister lost favourite jumper party failed tell days happened
2016,father passed away cancer extremely saddened old matters worse actual death horrendous moving funeral saddened so
2017,walking beach boyfriend saw 2 people sex sand dunes view everyone fact chose area sex disgusted me
2018,told sister slept boyfriend mad felt shame act guilt
2019,stayed Coast weekend friends brother came drive home rude hurry rejoin friends embarrassed family involved extremely nice hospitable him
2020,allowed boyfriend touch me briefly
2021,ate 12 biscuits night tea watching TV  know why
2022,saw brother Church publically accept Jesus Christ saviour Lord
2023,seven years old swimming outside flags Gold Coast caught rip taken 100 m swim well older friend (17) swam saved me
2024,school write essay wrong do wrote essay mistreated got Saturday morning detention kids up
2025,closest friends died unexpectantly
2026,saw male engineer year came find female (I know it/them personally)
2027,Dad went Sports Day parent there cheering us
2028,owned shop serve occasionally took lollies stand Dad caught day
2029,holidays  driving road beautiful scenery boyfriend  talking feeling overwhelmed
2030,Lying friend trivial
2031,promised task close me outset knew important it came it let down
2032,Good news sick relative
2033,Walking dark myself
2034,Getting terrible meals paying heaps them
2035,felt lonely writing family
2036,Person talking situation eating
2037,Felt spoke terribly (got mad at) person important life
2038,giving Lent
2039,received TE Score acceptance University  goal left bank year earlier
2040,time spider snake
2041,younger brother fighting TV/Video kept turning 2 seconds listening authority cheeky fought ended tears  hed won
2042,time left home
2043,camp  boys girls cabin guy forced girl intercourse girl bunk beneath pretending asleep ill
2044,new jeans split youth group
2045,17 told Mum came midnight 330
2046,Cant remember specific event  moderately happy year ago
2047,Left dark young
2048,Cant remember exact example
2049,Close relative dying cancer  found week
2050,Doctors ignored relative complained pain dying cancer
2051,best friendsfiancT broke relationship feelings stronger her felt him encourage leave stay  felt shame
2052,fact ashamed felt sadness
2053,person eat half cockroach cake knowing it
2054,situation center attention things happened control them showed disagreement ignorance
2055,let person assume fault committed
2056,finally found place live felt relieved predicting changes life happy
2057,dreamed attacked friend
2058,left person loved reason
2059,fight sister know care
2060,kissed soembody expect to
2061,day getting shower covered body towel (I 7 years old) cousin room
2062,finished love affair responsible sad end
2063,felt received letter telling classified national concourse p felt happy vanity it
2064,felt fear asleep dreamed dying asfixiated cardiac attack afraid woke desperate Altough afraid death afraid
2065,feel somebody traying stupid me
2066,felt home saw discussion sense parents
2067,putridness people fact catarrh spits whash streets SPaulo
2068,felt felt observed object pleasure (sexual) opened took shirt classroom PVC
2069,felt playing pushed brother fell cutting pieces tile
2070,asked girlfriend marry me
2071,drowned municipal swimming pool use excaping
2072,girlfriend guys like fuss girl
2073,death grandfather
2074,underground way suburb station LAPA Poor people ambulants badly dressed passage badly kept
2075,fight girlfriend luncheonette everybody stared way leave it
2076,pointed failure friend mine
2077,met friend seen time
2078,got jungle great number snakes
2079,unknown person provoked verbaly physically
2080,team lost championship
2081,dirty person smelling bad unknown laying me
2082,confused girl another
2083,complained caused great discussion parents
2084,began date boy till now 16 months ago
2085,learned girlfriend unjustly missed work
2086,got separated man loved
2087,acquaintance revealed light unexpected me
2088,school girl copying class work teacher spotted me
2089,sanatorium boy fell invalids chair help didnt felt like paralysed
2090,took entrance exams successfully got school leaving certificate delivering ceremony extremely official
2091,sit entrance exam fear possible failure
2092,indignant unimpartiality shown referees football match Bulgaria France
2093,got separated man loved much
2094,watching scenes Bertoluchis film \Twentieth Century\
2095,school girl copied class work
2096,unfair parents happened deceive trifling things
2097,admitted Sofia University
2098,come home late night
2099,talk silly pettyminded unmanageable people
2100,friend (girl) went abroad years
2101,happen witness sadistic acts
2102,plain appearance
2103,accused punished instead me
2104,admitted University niece born me
2105,bitten dog
2106,grandfathers funeral
2107,home New Years Eve
2108,walk child met drunk woman
2109,unaware walked streets torn trousers
2110,worked designer fitter hard hit damage occurred building site designed
2111,admittance University
2112,grenade blew me
2113,unjust calumny concerning me
2114,Unrealisation desired profession (aviator)
2115,Disgust subordinate
2116,lied friend
2117,Betraying someones trust
2118,Friends fiancT left me
2119,Winning Queensland Chess Championship
2120,car accident car total wipe (wipe out write off)
2121,self losing important game won
2122,Death grandfather (unexpected)
2123,smoking Electric train (Electric trains nonsmoking) alcohol smell coming person
2124,bathing surf beach  lost togs
2125,Promising job able transport troubles
2126,Receiving personal letter lady like revealed enthusiastic thought possible
2127,Introducing tutorial year University
2128,angry University tutorial ignorant loudmouth persisted trying dominate conversation
2129,left home Melbourne come Qland study hopped car hugged mother shook hands father Sensing immediately fathers sadness flood emotion
2130,parents verbally personally abused other
2131,felt akin shame heavy night drinking waking woman met husband epileptic later know knew mother
2132,felt guilty talking negatively agreeing person likewise nonpresent person
2133,love time
2134,child  stepping rusty nail  told tetanus
2135,child  8 years old  walking paddock  set boy claimed \his land\  intimidated boy  crying punched etc
2136,child  dog  getting disease dying
2137,Malaysian city girlfriend coming picture theatre  seeing rush taxi old sick man trying to Seeing taxi
2138,child  sent shop mother  buying chocolate  getting caught mother
2139,child  accidentally stepping pet guineapig  dying
2140,achieved 6 University long string 3s 4s 5s (7 highest mark awarded 3 conceded pass)
2141,night going downstairs hearing strong stirring brances wind
2142,informed flatmate that wed moved flat shed expected buy food separetely  event actually happened 5 months sharing began Prior this said nothing
2143,decide termination pregnancy discussing friends family man involved
2144,friend invite parents Graduation ceremony
2145,Saying rude jest photograph someone turn way
2146,14 years old \borrowed\ drink refrigerator intending replace later day found missing  owned disappearance
2147,child beloved cat gave birth beautiful little kittens them came followed out witnessed born
2148,embarking University life came different city know anybody Uni frightened known loved friends security taken away
2149,brothers cruel boyfriend flatmate bent brothers fingers fault
2150,moving away home time different city felt longer \under wing\ parents help me felt sense loss world responsible actions
2151,sitting rock concert listening extremely loud band tiny baby crawler left young mother right sun speaker screaming  probably pain
2152,lazy unthoughtful contact close friend shifted Gold Coast Brisbane month despite efforts contact me felt shamed finally confronted again
2153,felt let parents down especially mother sexual intercourse time times that Also went Pill
2154,weekend argued parents went home nicer soon walked in Mum kissed me Dad thanked birthday presents Id left him including sentimental birthday card
2155,Uni started leave home residence Brisbane (the \big smoke\) leaving home family moving big place intimidating first anxious it
2156,flatmate asking questions relationship boyfriend treating unfairly claimed hed treating me result angered defensive
2157,close friend Victoria visited holidays enjoyed company immensely 10 short days overwhelmed sadness left return Victoriaá
2158,flatmates came flat Monday morning find real Mess left guy share with
2159,weekend home week Uni scolded sisters best friends telephone silly annoyed time needed family
2160,Bictorian \friend\ staying house ere going places together sleeping together time boyfriend locally time face sleeping guy Melbourne felt guilty
2161,Joy giving birth sharing joy husband Moments complete happiness feelings love
2162,Attempted rape 5 guys  held arms molested me constantly threatening beat me Penetration occur driver car stopped that
2163,Anger doctors treatment giving birth left placenta bled heavily weeks  this felt weak emotional said needed psychiatric treatment support
2164,son diagnosed CEREBRAL PALSY age 5 endure labelling stigma discrimination case relatively mild
2165,adopted Aboriginal sister felt disgust racism subjected to
2166,cant remember feeling shame
2167,decided marriage ended left child felt overwhelmed guilt separating mother child
2168,Receiving notification successful application Speech Therapy course Uni gave good feelig achievment joy
2169,included questionnaire
2170,exboyfriend began date best friend seeing other found sleeping girl friend knowing told friend back
2171,mother left father best friend moved Papua New Guinea Despite fact closer father family mother goodbye father knowing again
2172,discovered mother affair fathers best friend ran away speaking letting come home school simply find gone filled disgust contempt
2173,recently sexually involved sisters lover care much ashamed hurt cause her
2174,stole shirt Department Store work promoted work privileged section store belief integrity makes feel guiltier
2175,Seeing close friend returned months overseas
2176,Finding public toilet block man known great psychological disturbances
2177,seeing \uncertain\ child work model hours watched \bully\ age destroy it telling child worthless
2178,Leaving home closer University oldest child experience traumatic parents myself
2179,Viewing results senseless vandalism local primary school
2180,slept man purely found physically attractive influence alcohol
2181,Inventing fictitious series events result ended conflict closest friends
2182,finished exams 12th Grade worried getting TE Score high Physiotherapy found accepted ecstatic appropriately jump joy
2183,going drivers licence time everything seemed hinged getting it nervous testing Officer little afraid well lots things worry about passed however
2184,socalled friend let down promised tell certain concert occurring shed tickets looking forward it nothing told blue day fantastic concert going be
2185,family heard Mothers cousin lives England wrote tell cancer lymph glands
2186,found people Ethiopia starving government spending millions celebrating power years saw people TV needing food etc
2187,went visit Montrose home crippled children interview handicapped child interviewed boys went well promised visit them got time hope theyve forgotten me feel ashamed letting down
2188,driving parents car carpark shop own scraped corner panel corner fathers utility tell anyone lied bump (later confess)
2189,years ago somebody like wanted studies tried understand importance going do difficulty find job decrease culture etc person test college entrance examination great joy found succeded entering University
2190,night got University saw strange people near car got near moved away came close again feeling assaulters left discovered windshield broken
2191,day crossroad somebody crashed car got person laughed me felt great anger got car went away
2192,know suddenly thought feeling boyfriend love years together matter fact shaked felt great sorrow sadness
2193,Returning home late afternoon saw indecent act man purpose saw it
2194,school parting agreed restaurant met school separated cars car broke arrived late arrived stand applauded entered hours late restaurant attention turned us
2195,little girl years old broke bey closed Mother asked it said me lied brother frequently spite brother denieing mother gave slaps
2196,entered University
2197,night friends went cemetery stopped car wall suddenly grave digger appeared wall looking like ghost afraid died
2198,teacher unjustly gave zero test saying cribbing
2199,grandmother died
2200,went restaurant boyfriend dinner saw couple man couple negro manners eat
2201,teacher asked read composition homework stood invented it colleague saw copy book written accused called directors room
2202,took away best friends boyfriend
2203,end semester got approval matter judged difficult
2204,Crossing street ways cars began thought going trampled
2205,went school library asked book librarian told such colleague asked gave him
2206,colleagues decided Saturday inviting decide place time
2207,teacher giving test called student name (the teacher) said liberty
2208,day intimity girlfriend ejaculation
2209,answered mother rudeness
2210,situation felt happiest life person love time
2211,Fear thief
2212,feel anger somebody forbids something
2213,felt sad despised person
2214,felt disgust dirty
2215,Shame well
2216,felt guilty help person
2217,got examination driver licence finished knew passed it
2218,inside car husband assaulted gun 10 oclock evening
2219,changed office room agreement
2220,sleep began remind childhood sisters time spanked lot know started remind spanks had shouts happened
2221,red report magazine VESA Iranian telling lived prisons Iran felt disgust people
2222,comment moment fit
2223,niece 3 years old living room fixing table birthday party and child stay calm burst balloon told quiet father pinched her believe said happened
2224,ILHA GRANDE wonderful sun wonderful people wonderful sea wonderful boy
2225,looking job felt lot fear fear greater found it
2226,feeling occurred colleague entered GV (University) didnt
2227,applied college entrance examination FUVEST approved second fase
2228,feeling met girl dirty \fresh\ dump childish
2229,fat ashamed body
2230,exboyfriend want sleep anymore insisted love felt badly felt guilty
2231,felt happy mother borrowed car order let time
2232,felt afraid smoked maryhuana time life lot friends middle street day brake
2233,felt anger fight father beated me mother came help (because beeing beated) beated mother
2234,happened lost intimate friends car accident
2235,felt disgust father knew lover
2236,mother found smoke maryhuana
2237,felt guilty \stole\ boyfriend friend mine
2238,succeded
2239,danger nearby
2240,feel anger things come wish
2241,trip friends holiday
2242,Disgust drunkers blood
2243,Shame reprehended
2244,shout colleague classroom
2245,possibility getting better professional life valorized aspect People showed possibility real fact (even )
2246,curious went spiritism session friend times (many times younger) day believe spiritism terribly afraid happen (sort incorporation )
2247,denied job person propsed giving political reasons directly professional level
2248,informal talk friend talk life person common friend situation able assume certain problems decided solve is suggested problems decided solve moment
2249,friends camping weekend little food met middle age couple small town invited eat house house small badly built old dirty forniture utensils problem pans dishes food
2250,went meet family boyfriend party house mother eager know friends ready jokes situation
2251,met person began him boyfriend (with marriage accorded) met great scandal broke engagement began other work mind mixed up
2252,got wedding ring diamond boy loved
2253,Afraid getting friends anybody
2254,stole dark blue tennis
2255,conscious men wnat goal have: sex important
2256,went clinical hospital saw conditions people attended there
2257,day carnaval met boy began flirt him love him introduced friends died shame before met boyfriend carnaval
2258,pass examinations FUVEST felt guilty studied opportunities drew out
2259,met great friend talked little him miss
2260,feel afraid way great friend looks me little afraid directions going
2261,felt anger friend met \a date\ nervous pest gets meets him
2262,knew day great friends existential crisis mainly notice Im situation are realize it
2263,friends acquainted guy vacations thought disgusted \a friend\ feel little disgust wanted stay him
2264,felt shame talk person seen years Shame recognize know say
2265,wished secretly lied friend want stay house beach (as does) stick me
2266,entered University
2267,afraid times marked enter University
2268,Im crazy football team lost goal Paulist championship lost classifications
2269,grandmother second mother died
2270,girl liked accept curting
2271,sexual relation work
2272,father fight sister me
2273,met girl asked date agreed (I thought girl like me) emotion joy
2274,fact girl (22 years married  guilt  disgust) fear main factor relationship
2275,car (sadness) felt anger way acted negotiating it
2276,buy car like business car
2277,met girl (22 years old) married liked her asked date kissed her discovered lived nearby passed day got amused thinking husband   talked anymore
2278,mother looked drawer (where personal things) found porno photos kept week split it
2279,girl (22 years married) felt guilty relationship
2280,felt joy red list approved entrance college examination
2281,visiting parents law house invaded strange men committed armed assault
2282,Nearby end year wife car ride appears vehicle driven drunk driver provokes accident
2283,friend months circumstances met feel happy good things learned friend
2284,left carnaval ball 4 oclock am foreign city home guy appeared tried \catch me\
2285,fact informed greatest trust person
2286,friend lent apartment holidays fine person Months later knew died tragically moto accident young felt sad believe (until today)
