,Clean_Text
3719,dying close member family
3720,Seeing maltreated dead animals
3721,older man took advantage childhood (four years age)
3722,friend needed help I moment end relationship
3723,passed important exam
3724,man rang doorbell wanted enter house violence home moment
3725,friend came visit late night promised stay quarter hour stayed 5 hours  leave angry
3726,terminate training suited it sad this wanted finish training
3727,birthday party friend drank alcohol throw up Worst leave friend molesting her
3728,tried swindle jeweller watch broken wanted repaired pity detected it
3729,lot efforts work help finished sooner mood help him
3730,went visit friends companionable
3731,wanted contact girl loved afraid refuse me
3732,military service superior reproached unjustly led friction lot situations
3733,Disappointed love girl end relationship thought love me
3734,military service heard story tried commit suicide result got week custody
3735,thought clumsy love time girl
3736,friend bicycleaccident pulled handlebar
3737,Sitting quiet room concentrating things happening pleases me
3738,Sitting quiet room concetrating things happening you Thoughts come mind afraid
3739,teacher tells story true reflects way interpreting reality
3740,high expectations future pursue subject manner attain this
3741,heard broadcasting programme parapsychology people programme difficult words understand acted exaggerated showing feeling
3742,girl asked dance told ashamed dance felt ashamed tell this
3743,saved money good purpose organise party afraid rest little money good purpose feel guilty this
3744,sister brother law returned Sri Lanka adopted child went pick airport
3745,football game offence acquaintance Later acquaintance tackeled game rude
3746,work petrol station foreigner wants petrol collegues treat impolite
3747,uncle retired worked hard life got cerebral hemorrhage
3748,student lives house live alcoholic tries manipulate people money drunk much
3749,went disco friend started behaving badly embarrassing reason
3750,talked student notes got semester knowing got lot bad grades
3751,got drivers licence
3752,stayed house Great Brittain lot rumour newspaper murderer free
3753,stories way grandmother treated mother
3754,mother proved suffer disease
3755,stories aunt beaten humiliated uncle
3756,omitted favor friend need help
3757,little accident bosscar
3758,year carnival joyful intense feeling happiness then
3759,event remember nightmare young (3 years old) dreamt machine going crush me
3760,usually angry myself happens often instace want pet falling love soon proves fallen love him
3761,Losing boyfriend second time friend fell love her thing happened months earlier boyfriend
3762,person disgust Evrey time terrible feeling disgust appearance
3763,angry good reason Later proves wrong
3764,mother evokes feelings guilt me instance miss bus know concerned stay awake till arrive
3765,came contact girl liked much important liked me
3766,REMEMBER
3767,hard day university dinner evening failed frying pan broke
3768,father cerebral hemorrhage
3769,story heard recently baby dying sexual abuse
3770,party overheard conversation china wanted opinion people came Chinese opinion right course
3771,bring girlfriend home night Later told cardriver solicited her
3772,old schoolfriend phoned arrange appointment talk old memories seen 8 years
3773,Standing crowed shop closed room people it gives fearful experience
3774,older brother gives unwanted advices problems relationship girlfriend
3775,girlfriend left house lived months ago sad
3776,parents behave \witty\ me insipid jokes laugh mother treats like little child
3777,Making unexpected talk professor canteen shy
3778,Flirting girls good relationship problems relationship flirting increases feeling guilt
3779,Occurs frequently recent experience: going friends nice music examinations felt happy embraced everybody
3780,lived repulsive area city Rotterdam annoyed heard lot Burglary assaults Especially evening night frequently felt anxious
3781,treated unfairly hurt love
3782,finished relation years leading sorrow (\although best solution\)
3783,time meet certain person together dislike other
3784,coming trial shop lifting
3785,catched stealing
3786,fell head ears love appeared love me happy hardly sleep eat week
3787,night bike home party found pursued man car
3788,quarrel father opinion decided authoritarian way TV program watch angry started throwing things room
3789,boyfriend finished relationship started studying psychology Nijegen able meet frequently anymore
3790,friend quarrel mother boyfriend friend decided live together needed money removal great effort reconcile
3791,catched when little girl played tricks startled wet pants
3792,opinion 1200 pm early home going out stayed away longer knowing mother worried
3793,called invited talk job wanted have
3794,late night (around midnight) person asked lift suddenly tried attack escape followed little while
3795,lot irritation person lives house live Suddenly accused things
3796,end relationship (after 4 years) hurt person much
3797,saw terrible accident driver motor thrown frontwindow car face completely away
3798,troubled hair growing neck troubled long time ashamed brought his/her hands close face
3799,approval parents went days boyfriend Germany
3800,friend came unexpected visit
3801,thought house fire night
3802,official meeting asked question person response directed chairman
3803,mother good friend died
3804,teacher blunt relation child child upset arriving home
3805,angry someone
3806,time appointment someone
3807,saw family good friends staying year foreign country
3808,good friend behaved cool manner long time
3809,library medical psychology walked wrong direction man came room threated denigrating angry resisting manner
3810,good friend died funeral felt intense feeling sadness
3811,uncle ill started cough wich sounded dirty (He cant help course)
3812,Christmas night good movie television wanted years whining till told childish felt shame
3813,good friend moment foreign country write months feel guilty
3814,friend money good sense favorite dancing
3815,going threatened regularly punkgirls
3816,friend started shout me called old frump
3817,relationship boyfriend finished succeed yearscourse
3818,father disgust comes close feeling disgust overwhelms me stay weekend parents place remember long time
3819,party love boy public Later heard talking called slut
3820,got associated boy year ago neglected best friend relation boy finished behaved easygoing me felt guilty then
3821,winning goal important football game
3822,terrible cloudburst started camping tent great bald field
3823,Seeing time pictures called \treatment\ Jewish people NaziGermany World War II
3824,death motherinlaw long sickbed moment dying her
3825,looking oneman television told disgusting things started disgusted it (Later proved intention)
3826,drinking glass wine eating suddenly appeared pictures famine parts Africa
3827,parents Sunday phone tell study truth listened sports radio
3828,appeared pregnant weeks overtime
3829,situation sadness afraid parents distroy relationship
3830,parents distroyed relationship
3831,feeling parents distroyed relationship boy thought bad irresponsible
3832,accident described SHAME came saw terrible looked like disgusted saw
3833,sudden end relationship girlfriend
3834,heard conversation talked low women
3835,important situation me father behaved inadequately
3836,took car saying him
3837,felt joy heard accepted Free University Driebergen
3838,good friend told evening want live anymore
3839,felt anger end telephone call good friend told travel year good friend talk out
3840,sad leave persons intense relationship leave environment this
3841,felt disgust watching picture television torturing political prisoners India (this happened India Indira Ghandi)
3842,insulting remark person care much event caused person like person insulted
3843,felt guilt mother went live rooms Nijmegen study
3844,boyfriend went dinner subsequently went family nice evening
3845,walk streets late night friends attacked night reason it
3846,got feeling housekeeping boyfriend anything happened period exams study hard
3847,best friend got boyfriend relationship years finished abruptely
3848,feel disgust hearing seeing people treated inhumanely example torturing chili
3849,opinion guilt feeling goes shame refer situation guilt
3850,angry boyfriend reason know bear angry cant study anymore then
3851,day heard passed high school exam
3852,living rooms lonely quiet neigbourhood night silent frightened me fact house frightened me
3853,different city company father worked moved place difficult new friends than
3854,close friend died read newspaper know thought day
3855,girl hires room house live tries quarrel available disgusts me
3856,teacher spent lot time helping wanting paid it exam got good grade felt ashamed
3857,knew exam soon start studying knew imprtant succeed exam time
3858,Christmas holiday started felt joyful finished exam
3859,raped went dark alley house man pushed bushes fought succeeded escape
3860,angry father money brother use studying brother better me
3861,gradmother died felt sad  feeling started worse while
3862,ate rotten apple
3863,meet appointment made person phoned thought (I told ill) go
3864,exams excited time housekeeping friend everything
3865,boyfriend playing cat playing games telling nice things her
3866,slept time house live now man phoned 200 am wanted me afraid
3867,boyfriend told high demands him opinion wrong
3868,parents place long time went visit high expectations different expected
3869,read story newspaper butchers treating animals badly disgusted me
3870,eating nice restaurant servant asked liked food told liked thing good servant worked hard good
3871,weeks ago thought exam soon remembered sleep felt guilt beginning year planned succeed
3872,high school time succeeded play concert Mozart piano gave performance succeeded play well
3873,car ran me moment felt street thought \This end going die\
3874,cat killed caraccident angry driver car care
3875,boy love much asked dinner me refused know me felt lonely
3876,saw dog eating excrements
3877,Highschool time chairman students comitee function speech large audience nervous sentences forgot text
3878,holiday EastGermany got aquainted boy lived there started writing wrote once felt ashamed probably sparse contacts western Europe
3879,saw good friend seen long time
3880,slipped glazed frost road car ran me
3881,people permission pry belongings things it
3882,noticed parents prosperity people surroundings
3883,Seeing pornographic movie animals used
3884,went time life nudistbeach
3885,caught sneaking sweets
3886,went visit friend hospital undergo operation rupture glad hear operation succeeded relieved pain
3887,appointment good friend came 3 hours later agreed upon hour waiting afraid happened usally time
3888,worked student computerassignment best prepare it expected explain her
3889,quarrel good friend fact pay visit expected come sad real quarrel
3890,hitchhiking man stopped gave lift Nijmegen ride asked fun man fat tatooed
3891,forgot agreed good friend
3892,angry friend shopping agreed this angry proved reason felt guilty it
3893,got positive result examination achieve Bachelor Degree Plychology
3894,12 years old frequently pursued got sound thrashes
3895,girlfriend day went promised 600 pm arrived 1000 pm message (we evening)
3896,girlfriend decided finish relation
3897,drank felt rotten morning after
3898,overslept second time day examination
3899,relationship love girl
3900,girl love smiles me
3901,biking felt bad (problems heart respiration)
3902,discussion resulted insult opinion justified
3903,realized sense start relationship girl constructive establish firm relationship
3904,finish big amounts homework time
3905,gave water plants friend plant fell over little statue broke I course tell everything
3906,broken piece glass refrigerator putting hot pan it
3907,birthday good friends came visit me
3908,went apartment boyfriend saw people door thought happened
3909,father called (behind mothers back) told mother disapproved behavior weekend However tell details left unanswered questions
3910,felt lonely dissatisfied realised feel jealous women boyfriend
3911,scene film man repressed one concidence position reversed man repressed identical way before
3912,succeed making clear people understand say
3913,death girl disliked
3914,felt joyful boyfriend met station said that
3915,startled when night 200 am boy approached yelled \I fuck you\ stopped laughed me
3916,listen asked repeat said happened time person
3917,felt sad heard friend committed suicide
3918,night saw man knocked men victim kicked head
3919,acquaintance parents boyfriend time spoke Limburgian (a dutch dialect) remarks disliked Limburgian dialect
3920,cancelled appointment idle story appeared person looked forward reserved time it
3921,days felt miserable distressed listless crying fits felt happy special reason
3922,testing new roller skates street suddenly dog ran barking direction threatening startled terribly upset
3923,weekend group people everybody felt irritated night music stop time breakfast boyfriend ran away agree him felt angry
3924,Recently felt sad reason lasted days liked period
3925,told story Amnesty International: boy killed head litter girlfriend looked pregnant died disgusting hardly write down
3926,cried 3 hours felt miserable called boyfriend said lovely things me feeling disappeared felt ashamed
3927,Yesterday boyfriend wanted play billiards boys playing (5 times) boyfriend fed chagrined case think fault
3928,boyfriend experience nice nice walk together
3929,weather bad (fog slipperiness) newcast reports traffic accidents boyfriend driving home 60 kilometers go
3930,told stay home night big efforts ok (food) day cancelled appointment church parents
3931,cat vet mercy killing (an injection)
3932,people eating unsavoury (smacking belching speaking food mouth etc)
3933,girl class nicknamed \fatsy\ Later heard suffered diabetes mellitus
3934,appointment pick someone arrived late wait quarter hour
3935,night good conversation friends realized worthy happy friends
3936,morning going dentist
3937,close friend intimate bodily relationship (he girlfriend) started avoid want talk more
3938,good friend intimate relationship clear want continue way choose girlfriend (also friend mine)
3939,love love considered unlikable
3940,short lasting sexual relationship love
3941,realized avoided good friends shared toys sorrows idle stories avoid telling happened me
3942,boyfriend suffered form ill health months week physician told restored health
3943,going weekend bike 5 kilometers lonely dark polders terrifying fantasies
3944,appointment friend drink coffee togehter However time week arrived hour late
3945,dear hamster (called Hannes) died age 2 1/2 years shape forced mercy killing (an injection)
3946,read newspaper report little boy forced look sister raped
3947,appointment complete piece work appeared prepared anything
3948,mother week week completely forgot morning called me thought felt ill
3949,funeral acquaintance felt depressed feeling turned joy heard achieved good grade examination
3950,appointment conversation afraid fail
3951,When cleaned kitchen hours later saw big mess irritated much
3952,night called told father close friend died visited friend home attending funeral felt sad
3953,remember exactly situation know went dirty lavatory disgusted me
3954,coincidence clutched stranger (in intimate way) thinking boyfriend hindsight feel ashamed thinking it
3955,torn inner tube bike mine saw brand new one felt guilty then
3956,found girl love loved too
3957,mother threatened thrushing stairs comment
3958,look fool teacher class turn
3959,mother unjustly angry sent room father explained way saw things correct things best intentions
3960,mother angry little sister told hands table order beat hands up forced means power
3961,friend came dinner home parents ordinary people mother however expensive porcelain dinnerservice silver cutlery felt ashamed
3962,falling love imagined particular girl perfect completely overshadowing girlfriend realized image objective felt guilty girls
3963,week work volunteer biologic garden work garden contact volunteers filled joy gave support failed passing drivers test
3964,friend planned search old documents utensils cellar late night arrived cellar indicated place police (40 years ago) found dead bodies got scared told story
3965,compliment examination moment needed it amicable hearty sincere
3966,went stairs high dark house shadows passed door feeling me knew alone
3967,friend told better familiar terms friend although opinion reason things said hoping search support (that however necessary)
3968,good relationship friends reason clearly showed thought naive dull unable care myself expostulated manage things
3969,people remain cold egoistic regard close friends situations friends need them
3970,state things great positiveness try convince others appears statement right
3971,certain friend evokes positive feelings negative feelings present feel need express negative feelings However speak him think: like this deserve this so
3972,days ago hitchhiked Arnhems friend went well: picked quickly sun shining feeling free and time long time happy feeling living speed
3973,grandmother times struck cerebral hemorrhages recovered time threat loose her
3974,appointment friends together arrived place persons there angry thought gone me That however appear case
3975,finished relationship boyfriend felt unhappy long time
3976,days finished relationship boyfriend quarrel hit me moment found disgusting
3977,taking shower cubicle France discovered children loking adjacent cubicle
3978,know certain person feels lonely looks forward seeing me However busy visit her feel guilty
3979,close relative underwent difficult operation turned fine
3980,tube train paying ticket
3981,classmate urged carry particular protest him time came fellow drew face situation
3982,failed entrance exam IMEC
3983,saw eating live worms
3984,child parents caught pornographic magazine
3985,told got study grant
3986,wore grotesque figure hanging back
3987,studied
3988,father saved severe work accident
3989,child hid sheets fear darkness
3990,saw person begging
3991,basket ball team lost qualification final
3992,rotten meat
3993,person want continously present
3994,failed exam thought pass easily
3995,got know passed university entrance exam thought exams badly
3996,young day street father brother father talking friends saw dog began pat it father told sharply stop dog mange brother told die stop crying this
3997,hitch hiked way town drunk dropped town unknown us needed urinate wall turned belong military headquarters arrested pay fine 500 pts home foot (6 km) late lift
3998,meet girl discotheque pretty happy turn up Thank God friends able good time
3999,classmate stupid like respected him tried talk someone listen bear seeing this
4000,met friend discotheque girl told girlfriend I something commented viscious woman told girl
4001,went pub group friends (not close) girl time girls group wanted me stopped talking girl with
4002,day friends decided Galicia holiday
4003,exam I finally take
4004,home lost pieces puzzle
4005,argument friend
4006,dirty shower days
4007,money pay coffee
4008,argument friend mine
4009,friend told passed entrance exam university
4010,taking exam
4011,family told leave willing accept conditions imposed me
4012,friend called home phoned know wanted told dialled wrong number
4013,change babys clothes time
4014,fell outside door house
4015,younger sister run lorry
4016,brother born
4017,fell rocks acting foolishly playing dangerously
4018,saw children hunting cat death
4019,death friend
4020,saw scene TV castration shown
4021,answered father rudely
4022,brother ran away home thought continously scolding him
4023,saw passed university entrance exam forget problems
4024,got shut school friend jump window cross beam 10 metres high
4025,told boy want friend apparent reason
4026,learnt boy liked girl years
4027,dirty classmate farted presence terrible smell
4028,realized hole trousers gone walk
4029,argument grandfather day younger brother born
4030,saw 16 year old sister home waited night knowing was
4031,waiting marks difficult subject year
4032,argument mother criticized rules imposes home rigid arbitrary me
4033,learned friend speaking boyfriend week argument unfounded jealousy
4034,seeing scene accident magazine
4035,days ask professor ridiculous question lost game cards pay forfeit
4036,shouted mother nervous depressed
4037,days delay girlfriends menstration glad pregnancy test negative
4038,saw TV program North American military plan called \The startwar\
4039,felt angry saw TV slaughter negroes South Africa
4040,saw pictures draught Etiopia
4041,alcoholic
4042,New Years Eve went house girlfriends parents meet them
4043,failed exam knew studied hard enough
4044,day Real Madrid team basket ball qualified final Athens
4045,time face face monstrous dog lives street
4046,trivial (friendly) discussion participants intervention feel uncomfortable
4047,heard regulation socialist govrenment concerning pensions
4048,got know details famine East Africa
4049,time phone Registry called times days
4050,argument brother behaved intransigently cruelly wishing morally hurt \person\ opposed me
4051,passed important exam
4052,important exam caught red handed copying
4053,father addressed directly maliciously including \family war\
4054,parents got divorced
4055,child day playing fell waist mud
4056,dismissed job accused theft
4057,girl love me bed her
4058,passed exam failed year
4059,night
4060,murder
4061,failed subjects year
4062,people sentiments
4063,think shy mix people liked to shyness
4064,triffled people
4065,told week trip friends
4066,time went home school report
4067,argument friends accused taking advantage friends usually come university car saying ask money petrol
4068,learned friends car accident
4069,young man insulting humiliating drunken man
4070,aunt phoned ask refused invitation dinner home New Years Eve
4071,girl night again asked so
4072,saw passed exam chance lot stake
4073,trip Santander wanted stop curve friend sick car skidded gravel
4074,cousins playing home broke decorative object precious me
4075,friends arranged afternoon snack tell me told phone number think true
4076,saw film black rapeing girl filming pornographic movie
4077,swimming sea wave took bikini away
4078,looking child fell paying attention face got bruised
4079,pass exams close friend recovered illnessetc
4080,Fights middle street robberies fear darkness going home
4081,family discussion future prospects student accused bothering looking job assume financial situation
4082,people like all reasons physical appearance
4083,example feel bad ones attire people belong social class wrong answer class surprised particular situations
4084,friends argument earlier phoned influenced argue
4085,met close friend year separation
4086,earthquake minutes floor
4087,argument friends irrational behavior fell reason said blame
4088,classmate died months coma car accident
4089,Pictures Nazi extermination camps TV program
4090,Equivocal situation filling security questionnaire entering government building people there
4091,left boy going giving explanations
4092,sister born
4093,tried rob me
4094,failed exam unfairly
4095,grandmother died
4096,dead dogs road
4097,went doctor clothes examine me
4098,parents quarelled wrong
4099,little sister born
4100,attending authorized demonstrationand police rushed brutally demonstrators warning
4101,professor faculty laughed at suspicious composition written classmate me
4102,death relative friend esteem
4103,saw disagreable scene
4104,represent boss meeting
4105,inadvertantly close friends relatives feel bad
4106,passed exam
4107,threatened knife money
4108,failed exam thought pass
4109,dog died
4110,saw accident man lost head
4111,tripped getting bus
4112,hurt persons feelings
4113,seen brother years Spain arrived airport felt great joy
4114,drug addicts tried away money
4115,saw brother attacked anything
4116,classmate died
4117,person saw accused defend me
4118,inadvertantly found ladies room
4119,broke friend blamed
4120,got driving licence frightened difficulty
4121,walk kms field wild bulls car broken down
4122,saw man hitting child 2 years consideration simply child leaning window
4123,friend driving car ahead died car accident
4124,dissect live mouse school
4125,child recite poem end term
4126,saw program Ethiopia TV fews hours earlier thrown away clothes food
4127,saw mark obtained exam good one
4128,country walked away night Suddenly moved sharply able was
4129,young angry allowed stay night fair town
4130,summer leave town spend holidays
4131,saw people washing car water drain
4132,inadvertantly entered ladies room met girls way out
4133,entrusted object handled carelessly broke
4134,learned ecography mother expecting baby girl wanted
4135,night walking park began think roughnecks appear suddenly knives things like that
4136,exam prepared know second part
4137,parents let study tour
4138,day going street door house man asked doctor showed genitals asked cure myself
4139,time professor asks question class
4140,argument boyfriend fault pride let admit it
4141,invitation spend 5 days seaside expenses paid
4142,film zombies
4143,males family try assign house duties exclusively referance sex
