,Clean_Text
5414,Saw scene movie implying incest humorous
5415,given responsibility grade papers elementary school cheated little graded higher
5416,kid stole toys kids
5417,very Physics midterm
5418,house (late 8pm) heard noises Sounded like trying door
5419,friend let study want to feel need study understand important studying me angry her
5420,Death pet rabbit away brother allergic it gave man kept animals lots animals children watch went visit rabbit badly beaten rabbits eventually died
5421,stand bus stop hour waiting bus arrive
5422,sat wrong discussion section beginning semester insisted right section TAs list included name found wrong apologized turned red left
5423,helping sister asked help chemistry class pretended busy
5424,car
5425,Going driving test
5426,came home day discovered sister borrowed car gotten accident it entire bumper destroyed
5427,heard news grandfather died
5428,friend keeps telling morbid things happened dog
5429,purposely locked babysitter house age 4 LIKE HER
5430,work study midterm
5431,party met interesting female enjoyed eachothers company slow dacing
5432,friend going study session quiz biology material believed study enough feared fail
5433,live sister angers especially thinks apt clean enough
5434,found concert (after buying tickets) biology test occurred morning after
5435,Right volunteer hospital Yesterday Halloween dressed doctor went work volunteer coordinator told shift dangerous did
5436,exam grade desire mad better
5437,days weekends accomplish sudying wanted pleasant activities come up
5438,year freshman yr day March tests finally adjust college hot sunny walking frat heard Beach Boys \SurfinUSA\ overwhelming feeling CAL good somewhat
5439,year mother nervous breakdown father operation afraid family (4 kids Im oldest) hold together turned fine
5440,semester dated girl Ive known year night said wanted \just friends\ confided friend Jim suffering month later broke old girlfriend started going regularly girlfriend romantic relationship significance feel anger friends again
5441,Sr HS class counselors died hepatitis sensitive knew shyness drew improve image missed funeral  publically grieve parents understand
5442,applied job GALSO counselor strongest possible application denied interview felt disgusted system promoting cause minorities makes employing whites lowest priority
5443,angry 3 months ago kicked backwards wall caved parents angry mother said able find clothes size  Im sensitive about (6 5 210)
5444,lied week lied info paper writing told info newspaper article afraid told truth help me
5445,(a boy) paid special attention me
5446,Getting Psych 140 midterm
5447,roommate leaving drawers mess plowing thourgh looking something
5448,friend Bago kicked sorority
5449,friend sex different race Winnebago trip USC (all friends embarrassed sorority house name)
5450,lied best friend boy liked like her told bugged long time embarrassing herself
5451,Im allergic foods  eating Im allergic caused guilt
5452,genetices midterm  decent grade
5453,certain night initiation
5454,threw firecracker room 7:00 morning
5455,close friend family died
5456,people refuse house jobs work else
5457,share work house job
5458,Forgetting close friends birthday
5459,received unexpected B+ engineering midterm study nearly difficult test
5460,questions math midterm
5461,supposed meet girlfriend prearranged place took hour find her
5462,grandmother died summer knew well baked great biscuits hospital expected improve home soon died sleep
5463,saw Prince video crawling bath tub
5464,grand father caught eating private jelly bean supply
5465,slammed little brother wall bothering me
5466,Finding grades end freshman year
5467,going bring girlfriend LA meet parents
5468,found good friend roommate pay phone bill electric bill like promised let down
5469,found girlfriend coming UCB semester living San Jose
5470,Finding grades end Sophomore year
5471,found roommate talking personal things
5472,17 years old stole pens stationery store money
5473,Going Chico visit friend
5474,day job
5475,person Im affair talk public
5476,roommates sister committed suicide
5477,getting fat
5478,Lying grandparents visiting boyfriend Chico
5479,affair good friends best friend time best friend feel guilt cant tell him
5480,fell love present girlfriend
5481,bomb threat Tolman Hall time felt life danger
5482,people tell exgirlfriend playing me
5483,grandmother passed away
5484,study butt midterm average grade
5485,10 got busted stealing candybar
5486,copy elses problem set
5487,got good grade midterms weeks ago
5488,mom called early morning (On Monday) seen weekend understand important strange hour missed afternoon
5489,peers want meet rush fear bad outlook Sororoty house seen this blew did
5490,told friend friend committed suicide
5491,poorly midterm
5492,boat win race favored win
5493,Sleeping crew practice Monday morning
5494,achieved goal indirectly work CAL Football 2nd win season gratifying brought joy hard work involved fact expected win
5495,reading story serial killer Henry Lee Lucas given distinction killing people man began wonder care safety
5496,worked long hard project friend inadvertantly destroyed it forgive long time times angry him
5497,pet died pet closest friend 15 years
5498,people/press analyze particular newsworthy item (CAL Football team) member situation bad light team down
5499,Recently friends drink football road trip USC trashed hotel room felt ashamed maid walked morning
5500,felt guilty mislead person thinking close friend person casual acquaintance
5501,Getting accentance letter CAL
5502,summer camping friends devised elaborate plan scare camp attecked wild animal (one them) convincing campground home satanic organization
5503,went dancing found boyfriend kissing girl
5504,end senior yr high school found friend knew cancer diagnosed terminally ill
5505,Sitting dorm guys verbally reading letters Penthouse
5506,slipped butter evening Dining Commons landed rear causing tray land floor
5507,person attracted walked home rain got sick
5508,Today lot better architecture project expected
5509,little lost control bike started buay intersection neighbor stopped time
5510,summer got fight patrons (at theatre) hit hit friend hit friend hit eachother
5511,monday took Math 1BS test flunked second time
5512,found CIA mining Nicaraguan harbors
5513,month ago turned English paper late previous paper late promised again
5514,forgot mothers sisters birthdays (they fall day)
5515,received letter acceptance CAL
5516,time afraid broke fathers antique lamp
5517,told secret told tell
5518,mother sick died
5519,saw President Reagan elected
5520,failed tests year CAL
5521,stole something
5522,gave mom gift wanted years raflected joy
5523,Walking campus night squirrel jumped me
5524,long trip dads van incident stopped fill tank gas dented van pole cars electrical system work tried drive home house
5525,point relationship boyfriend seeing old flame me confrontation tears shed
5526,skunk invaded camp
5527,unkind remark ethnicity friends realizing it
5528,mangled dads van fence realize extent damage showed day shock face genuine friend interceded good excuse deny clarified situation
5529,finally got job days wondering hired counting money bring
5530,walk home dark time
5531,time when work sent actually sort volunteered run errand authority send address far especially foot turned incorrect too trip waste
5532,boyfriend said want anymore (which turned untrue)
5533,roommate forgets flush toilet
5534,poorly test knew excuse better mistakes believe made
5535,Remembering (at time feel guilt) recent yrs angry babysitting new brother stop crying harmful shocking feel guilty treating way especially adore now Thats spoil now
5536,Yesterday received B history midterm felt overjoyed received Cs previously
5537,began school UC preenrollment classes question success scared me
5538,month ago fellow workers got promotion me small promotion recognition involved
5539,fellow worker decided leave company close able work eachother longer
5540,media presentation kidnapped child raped
5541,accepted college dreamed going to felt let parents down
5542,told parents (or realistically) wanted anymore guess sort betrayed me
5543,drove partially country father stopped towns stayed overnight motels joy got feedom felt real beauty country
5544,day Christmas went shopping brother friend good time way home accident weather bad
5545,cant remember truly angry Usually disappointment feel situation brother close avoiding me
5546,4 years ago family decided New York California time decided time left realized friends cared me left long time sad
5547,babysitting neighbors children found roaches ther bathroom seen roach called mother sure thats were came checked
5548,time slept boyfriends house walk hall shower housemates felt judging me
5549,school went work work went friend stayed late got home mother awake felt guilty
5550,time sex
5551,getting fail notice math class realized school subject began fear failing class two
5552,Physically fighting girlfriend walked room friends pushed cursed went find her
5553,Hearing friend home stomach pumped overdosed pills
5554,learning news man killed 300 women habitually copulated inert bodies
5555,masterbated boy
5556,Going girl girlfriend telling her
5557,Reading letter close friend said missed cared me
5558,Going CAL knowing anyone
5559,close friend write
5560,Leaving high school
5561,roommate came home 10 morning sleeping guy know got drunk (Se boyfriend too)
5562,Fooling guy know
5563,noticing roommates quietness sign discomfort
5564,went home visited family friends
5565,Taking chemistry midterm
5566,away weekend friends went room played expensive stereo asking roommate
5567,asked girl date said no
5568,playing sport advanced PE class people advanced
5569,bought possible answer homework problem completely inapplicable question read subject matter
5570,Lately Ive felt guilty Im folling classes studying much
5571,Returning school rejoining girlfriend 3 months separation summer
5572,Waiting girlfriend come apt mine late thought awful happened
5573,bought new bed apt squeaks it tried fix not
5574,Finding grandfather died lived England seen 10 years
5575,Cleaning bathroom apt realizing roommate lived summer cleaned place
5576,poorly exam thought well
5577,Criticizing mother refused drive radio on told thought intelligent cope radio
5578,boyfriend getting dressed putting makeup Halloween Party dressing mimes enjoyable thought looked good accomplishment house
5579,needed recommendation something decided best person professor talked before felt lot fear going class ask recommend considering heard before did
5580,searching housing Fall UCB finally offered place  ordeal followed accepted refused  related parents judgment (theyre paying me) Turns upset Dad said hung him called threatened cut financially emotionally
5581,got news (almost) 21 years old brother died visiting Europe cerebral hemorhage finally hit hour saw corpse coffin felt like door closed locked forever
5582,reading paper feature Henry Lucas claims killed 380 people recreational killer necrophiliac zoophiliac raped beaten women killed men too
5583,people floor year close year 4 best friends live apartment boyfriend dropped birthdays stayed dinner people invited felt uncomfortable unwanted realized called rarely me
5584,talking mom phone told gotten award day people asked wanted send article temple newsletter me said quickly felt guilty interested hurting feelings
5585,found mother cancer
5586,tried break door
5587,friends betrayed friendship
5588,bad chamistry midterm well
5589,employer younger sister (17 yrs) \pass\ her
5590,Defying parents staying night supposed to
5591,Yelled parents buying car like parents
5592,Riding home school completing midterms days feeling them
5593,Occured preparing midterm Social Welfare thought going hard felt unprepared for
5594,Argument roommate lock kitchen cupboard telling anyone
5595,Day time robbery house
5596,Robbery mentioned sadness
5597,Caught lying father speeding ticket received
5598,Getting friend open container ticket got caught speeding
5599,found got accepted Berkeley
5600,moved away home feared leaving
5601,friend carelessly broke object parents house apologize pay anything
5602,felt sadness grandfather died
5603,person know lied income parents received money grants need person barely making it lie receive money
5604,big fight parents
5605,forgot close relativess birthday
5606,birthday closest friends Berkeley pithched lot money bought records replace records stolen threw small surprise party too
5607,skiing Squaw Valley riding chair lift right chair sheer cliff rocks chair lift stopped chairs sagged creak loudly
5608,received poor grade midterm got right answers knew material went TA try raise grade it
5609,girlfriend wanted breakup indefinite amt time said commit fully relationship going people boyfriend
5610,read newspaper 21 yr old woman found naked dead roadside turned relatives 14 19 kidnapped raped killed earlier
5611,went bed girl day thought start thought fun told interested starting relationship
5612,dreamed girl cuddling bed girlfriend walked in love girlfriend felt guilty sad know wierd example dream feeling clear happened
5613,involved car accident thumb caught glove compartment sister Fear finally telling parents sister driver
5614,coworker rush project working month years Instead letting know wanted project himself went superviser let superviser tell let coworker quicker it
5615,Losing pet chick family chick outside days morning gone
5616,RESPONSE
5617,RESPONSE
5618,told certain lie
5619,experienced joy friends 22nd birthday party good food good liquid good company good music overall warm atmosphere birthday girl communicate incredibly well felt content warm inspired talking giving neck massage
5620,summers ago best friend drove unknown mountains midnight pick broken car told horrifically scary ghost/murder stories succeeded scaring eachother pretty  heads knew fears unjustified
5621,seen pseudogirlfriend conversation angered greatly
5622,grandfather died thirteen years ago
5623,individual takes advantage and/or injures relatively defenseless individual consciously feel disgust mingled anger person dorm floor verbally assaulted person certain religious belief
5624,borrowed $ 2000 friend paid later originally intended
5625,angered close friend injured
5626,parents brother came weekend close family year away home brought jackolantern new design old joke great new design  same
5627,meet friends (girl) library 8:00 dark walking alone 45 minutes late kept waiting calling room places been
5628,studying chemistry friend angry eachother fed up
5629,received letter grandmother obviusly suffered lot grandfathers suffering health mentioned things gotten use
5630,good friends told people told confidence else
5631,wanted boyfriend stay didnt stayed left felt ashamed let leave wanted selfish
5632,party started talking guy seen classes boyfriend felt awkward left talk friend kept looking talked
5633,Football big deal high school joyous schools team conference championship year
5634,driving busy freeway rush hour slightly raining diesel truck coming close close pickup changed lanes barely hit truck ran Honda road scared death caused crash
5635,pissed Russians boycotted 84 Olympics anger Jimmy Crter anxious it
5636,sad hear construction company going build houses beautiful hills house
5637,vividly remember feelings disgust jr high classmates work schoolwork coplain tax money older successful were time pictured adults like knew complaining situation
5638,died caught cheating test high school time
5639,study tests High School particular remember physics test study friends talked boring felt helpless  guilt set close getting class
5640,took math midterm knew Friday felt great joy week test
5641,came CAL went rally Sproul later learned rally conducted Moonie cult taking pictures rally afraid circulate pictures kidnap people know cult worked scared
5642,faced writing essay want angry write essay angry time write good essay
5643,ran race CAL track team terribly coach said sit season felt sad going able run anymore
5644,saw girl economics discussion section smiling asking stupid questions TA attention obviously asskissing happens Econ discussion held weekly
5645,supposed girlfriend Saturday night got drunk friends earlier afternoon evening So totally forgot going girlfriend showed day remembered
5646,went bike innertube fixed fixed supposed pay previously didnt said fixed tire fixing tire salesperson helped gone walked store paying felt guilty went inside paid tire
5647,met good friends relationship grew closer boyfriend felt joy found felt me
5648,feared dogs eye infected much played weeds foxtail gotten eyelid took vet feared blind foxtail
5649,friends kept criticizing did thought kidding later found serious
5650,relatives seriously ill felt sad know again
5651,felt disgusted found betrayed me person dishonest felt used
5652,taking difficult midterm classes felt shame studying have ashamed results midterm
5653,close friend leaving graduate school state arranged gather people day left good time pay attention have
5654,spoke friend phone seen years joyful event talk him
5655,amusement park ride Marriots Great America went way air around Heights favorite spots life
5656,typed letter physician work care style correct English told letter way
5657,Recently sisterinlaws horse poisoned plant died horse obedient exceptional children
5658,disgusted behavior boys work scouting program showed lack interest unrest times plain rude behavior
5659,test class adequately prepared myself fare exam felt bad it
5660,supposed things mother plain it
5661,old boyfriend  yes  asked out good time asked following week actually took interest
5662,physically assaulted sexually abused year ago feeling away intact alive produced fear
5663,boyfriend breaking 7 months abortion fact ignoring continued so
5664,nephews mother left day (my brother married) nephew Anthony shaken sad similar situation happened me
5665,friends sitting restaurant talking said awful things women disgusted narrowmindedness
5666,tried months begin talking boyfriend again ignored me felt lowered pride \doormat\
5667,found pregnant talked boyfriend unsupportive  encouraged abortion  did
5668,got accepted CAL
5669,apartment robberies month guy upstairs got robbed making fourth
5670,roommates boyfriend assaulted me threatening me calling names pushing around
5671,going vacation Texas summer unable registration
5672,midterm Im disgusted prepared thought well
5673,dated friends boyfriend broken up
5674,friend going come stay weekend me came cancelled him
5675,depressed bad relationship love called told care matter did
5676,exboyfriend threw dorms talking phone guy jealous argument thought broke up
5677,tried rape best friends claimed fault hassled her claimed loose threatened sue her
5678,mother kicked surrogate father turn care dog Afthur bought family lack concern lead tho Arthurs death freeway loved Arthur like brother easy talk to
5679,thought guy associating year went 2 3 times high school girl claimed like
5680,fact pregnant considered level headed sex 18 high school
5681,pregnant thought baby hurt father like regardless life created
5682,spent lovely relaxing evening boyfriend played games talked evening
5683,walked church roommate bum told police started following us
5684,roommates moped stolen angry
5685,heard grandfathers wife leukemia sad
5686,disgusted find water filtered purified leaves Latimer Hall drains
5687,guilt apply
5688,added little  yield experiment yield
5689,highest grade class best answer given question (the question graded professor indicated liked answer)
5690,recent lightning storm bolts lightning hitting close (1/8 mile) bed time afraid struck
5691,repainting rooms house mother started enact plans paint room consulting me
5692,Recent breakup girlfriend year overseas discovered phone (while work)
5693,attended ceremony Denmark comparable Halloween build large bonfire place life size dummy witch crowd cheered dummy burst flames
5694,came home school keyed up dinner table unfortunately unloaded lot hostility parents Im ashamed dispate control feelings coming table let energy build place
5695,Eating remains dinner (unknown me) claimed
5696,watching 49ers lose game game year year finally rewarded Super Bowl victory extremely happy
5697,swimming hit head pool required stitches later learned consequences severe terrified me
5698,rushing home school 49er game night got noninjury accident fault destroyed car truck hit undamaged
5699,learned dad cancer knew going hospital tests mom told picked weekend CAL home
5700,49ers winners fans coming woodwork jumping bandwagon disgusts me
5701,small fight younger sister time hit knocked wind her felt real bad it
5702,grandfather nursing home young wanted later felt guilty
5703,felt joy boyfriend proposed marriage
5704,felt fear young left big house alone
5705,said boyfriend disagreed with walked away discussing bothered him angry treating way Yesterday November 14
5706,felt sad boyfriend apart time
5707,felt disgusted restaurant appear clean orderly (I like unclean environments)
5708,felt ashamed confronted teaching assistant close friend accused cheating math exam
5709,defend close friend father degraded him felt guilty allowing father away actions hurt friend felt cleared matter father weeks later
5710,trouble getting place boyfriend celebrated anniversary
5711,got caught shoplifting package gummy bears
5712,work crazy boss (a hyper Jewish lawyer) insists things way (filing typing etc) blames things do cant yell him
5713,moved dorms Ive spending free time boyfriend hardly old high school friends bad incidents 2 past best friends
5714,took psych experiment totally unappealing gay man experimentor homosexuals funny cute guy disgusting Plus experiment gays too
5715,grades parents say \How school getting good grades \ say \Great fine \ Actually feel ashamed myself
5716,Ive midterms past weeks hardly studied (like 1 2 days) feel guilty studied got Cs them
5717,Winning close volleyball game (Im intercollegiate team CAL)
5718,Speaking large group people
5719,situation  car stolen
5720,close friend drowned American River
5721,Getting low grade physics midterm
5722,Arguing friend politics informed issues feel ashamed political ignorance
5723,fathers car got stolen me (A 1966 Ford Mustang  hard replace)
5724,Getting sent company expense trip state work week plan
5725,second plane trip ran unexpected turbulence
5726,personal objects rearranged consent arranged taste trying find particular object rearranged hour more
5727,Death father
5728,Getting math midterm received lower grade thought get going questions felt grader graded harshly  errors
5729,Getting low grade midterm
5730,Promising task friend forgetting it
5731,finished CS Project overjoyed felt relieved day tired looking it
5732,overturned canoe years know swim lifejacket panicked
5733,came house 7:20 Monday morning getting ready school fight parking saw car flat tire
5734,little sisters Graduation High School grandmother sick passed away months later
5735,saw wino cans Food Stamps use change buy wine
5736,felt copying homework classes
5737,yelling girlfriend felt bad  crying upset
5738,party worries (ie tests homework etc) friends present good music
5739,Im afraid able school want suffering grades
5740,stood date function cared for
5741,blowing saying wrong things realized hurt person myself
5742,friends working common goal need accomplish
5743,supposed didnt person dependiong me
5744,confronting person stood up blew said wrong things
5745,realized girl liked me
5746,bad class Bus school
5747,dad told mother
5748,heard sister got bad car accident
5749,Engineer know wants war job making bombs
5750,bad test study for
5751,Decided minute said person
5752,passed BA exams class results
5753,BA results come
5754,failed SSC exam
5755,sister left home live husband
5756,trusted friend mine lied disgusted me
5757,failed SSC examination felt ashamed
5758,feeling falling love Coming person feel love happiness joy giving new beautiful future dream
5759,got know friend closest got engaged going away overjoyed her felt frightened emotionally dependent her know her
5760,angry brother argument together fights time time times anger him
5761,came know feelings reciprocated
5762,felt disgusted studying applied psychology mental testing papers BA
5763,habit wetting bed young day invited friends place stay night happened again ashamed myself
5764,felt guilty lied parents
5765,marriage received BSc results post happy learn got good marks  class
5766,weeks daughter high fever scared lead brain damage convulsions
5767,felt angry motherinlaw handle daughter properly fell bed hurt head
5768,sad MA (I) exams illness relative disheartened it
5769,parentsinlaw scolded me reason members family time called room studying exams
5770,teacher asked question class concerning read earlier know answer felt ashamed class
5771,friend failed exam mark exam asked answer sheet it results came out thought shown answer sheet passed exam felt guilty failed her
5772,family allowed higher studies
5773,decided separate husband
5774,father talks relatives favours them feel angry
5775,husband quarrelled reason all
5776,went walk beach friend seen months weather pleasant icecream lots fun beach
5777,day home coming home school know gone kept waiting come came getting late terrified
