,Clean_Text
0,period falling love time met especially met long time
1,involved traffic accident
2,driving home days hard work motorist ahead driving 50 km/hour refused despite low speeed let overtake
3,lost person meant me
4,time knocked deer  sight animals injuries helplessness realization animal badly hurt down animal screamed moment death
5,speak truth
6,caused problems somebody appointed time led consequences
7,got letter offering Summer job applied for
8,going home night Paris man came asked afraid late night
9,talking party time long friend came interrupted left
10,friends ask New Years party them
11,saw drunk kids (1314 years old) town Walpurgis night
12,remember presentation task accounts meeting
13,uncle neighbour came home police escort
14,time imagine love contact illness death
15,obviously unjustly treated possibility elucidating this
16,think short time live relate periods life think use short time
17,gathering found involuntarily sitting people expressed opinions considered low discriminating
18,realized directing feelings discontent partner way trying blame instead sorting feeliings
19,feel guilty realize consider material things important caring relatives feel selfcentered
20,girlfriend taken exam went parents place
21,When time realized meaning death
22,car overtaking forced drive road
23,recently thought hard work takes study wants try else read theoretical book English understand
24,found bristle liver paste tube
25,tired unmotivated shouted girlfriend brought negative sides character actually important
26,think study enough weekend think able accomplished time
27,pass examination think well
28,arranged meet person arrives late meantime starts thinking gone wrong eg traffic accident
29,unjustly accused done
30,ones studies hopelessly difficult uninteresting
31,finds know like thought instance friends steal things like that unwarranted
32,unjust stupid else
33,neglected unjust good friend
34,Passing exam expect pass
35,climbed tree pick apples angle ladder enable high enough implied ladder stable
36,Friends torture animals
37,Friends torture animals
38,children
39,2 year old son climbed sat 7th floor balcony legs hanging out holding tightly upper railing balcony easily lost balance sat down
40,partner attacked lost teeth
41,children TV areas devastated drought war
42,nearly walked blindworm saw crawl away
43,saw 18 year old son grab oxygen mask breathing difficulties bad conscience stopped smoking Medication dilation breathing tubes caused sense guilt me
44,experience sense guilt middle son express like children verbally writing
45,child born
46,winter/spring ice melting far jetty poked ice long branch try break it branch went ice fell in water closed head
47,Unjust accusations directed way acting close me
48,Failing examination
49,drunkard fell started bleeding wet himself Disgust turned sadnessunpleasantness
50,When adult caught lying behaving badly
51,environment person worse me realize privileged am
52,saw person seen long time
53,When child nearly knocked car
54,heard radio football match Belgium ended catastrophe people died understand normal people behave way
55,feel lonely study lot shut appartment happens particular time else
56,learns mass media wars killing going world
57,lied precise cancelled meeting good friend
58,lets friends
59,accepted course finance accounting
60,bus drove right leg event frightening wait emergency ward hours leg began swell frightened
61,Summer job looked particular learn own
62,accepted student finance accounting
63,moved new appartment found ventilator kitchen going clean found drum mud slime felt disgusted
64,elder brother good relationship feel ashamed talk nowadays
65,Summer job new caretaker employed age preferred going lunch accounts personnel him
66,Passed exam 2 points
67,cottage large forest dark
68,spoke JanErik Wikstr÷m telephone
69,Railway station goodbye
70,saw cripple rags small children Italy probably imposter
71,told friend going party enjoy came along understood fitted that
72,reason breakup friends relationship girlfriend finished him
73,passed exam absolutely certain failed
74,way Denmark friend small yatch storm friend blown overboard scared till managed onboard
75,locked out
76,missed tram home walk pouring rain
77,found worms food obviously eaten some
78,friend intoxicated police came took away later contacted parents
79,hapened overhear meant hear
80,trip Greece competition
81,dark suspicious looking character comes me
82,work elderly man complained unjustifiably distrusted me
83,understood lecture
84,alcoholic stood dribbling food counter
85,friend discussing good looks guy realized listening
86,complained colleague manager told complained colleague came believing liked her
87,friends birthday party closest friends pleasant happy good friends
88,way home Friday night heavy rain car acquaplanned lost contact road surface seconds
89,Mad dad
90,case unrequited love
91,bad smelling cucumber
92,Nearly caught masturbating
93,help home
94,felt happy football pools
95,flew Athens Copenhagen holiday plane caught storm began shake thouhght going crash
96,stole bike
97,saw list books read acccouting course thought \ Oh God manaage it\
98,read newspaper article future foresaw eating frogburgers year 2000 illustration showed frog pieces bread
99,dropped bottle state liquor store everyboby started laughing
100,young  14 pinched store caught store contacted parents
101,family gets week holiday Everybody feels free trip planned works enjoy ourselves
102,find 2 year old daughter ran looked find her (I finally found her gone bed sleep)
103,friends try hurt me
104,Marriage crises Boredom
105,makes advances want
106,discovery thought oneself
107,spanked child anger later regretted terribly
108,passed examination repeat
109,drove Stockholm time drove Stora Hissingen road wrong exit
110,boyfriend went away month long holiday me
111,year worked Summer holidays studied time examination repeat boyfriend went Greece holiday month
112,dog left whining outside shop
113,promised help friend weekend promise
114,realized examinations take
115,day told accepted student economics
116,taking short cut Vasa park surrounded people tried steal money scared saved appearance people
117,restaurant observed gypsies tried money cheating foreigners ie non Swedish speaking anger hatred foreigners expression anger feel people 
118,begining new course afraid encountering problems manage Thoughts revolve failing subject consequences future
119,walking town noticed police harrassed man influence alcohol terrified thought arrest driving close pedestrian street disgust directed gestures facial expressions policemen enjoying themselves
120,boyfriend revealed knew discovered things important nature him felt ashamed mentioned earlier
121,dishonest friend close feel guilty know gives different version truth corrected mistakes aware know wrong
122,found passed exams margin marks
123,father ill waiting results tests
124,got caught pouring rain Thursday raincoat me
125,failed exam
126,Sm÷rgasbord table man mixed differnet kinds picked herrings fruit salad
127,prepared contribution group thoroughly members result overall result poor
128,father worked house recovered illness lazy meant work hard later
129,gave birth son saw alive managed well born month early malfunctioning lung happened year ago
130,found father lung cancer know long live
131,colleague asked help work despite fact time had
132,salary increase expecting understood little ones work appreciated
133,weeding garden found lizard hand
134,met friend seen long time heard troubles thought got touch earlier
135,got angry mother trivial bad mood father ill knew mother needed support reacted wrongly
136,New years eve 1983/1984 met girlfriend stood steps outside parents home kissed time
137,stopped plain clothes policemen car driving overturned Avenue driving fast afraid stopped questionned toild go situation ended happily consequences
138,editor changed heading article written considered heading derogatory person written about
139,close acquaintance family died lung cancer expected felt depressed
140,saw picture Gothenburg Post totally demolished car fatally injured passengers car badly damaged bodies scene accident
141,night sexual intercourse man sexual desire curiosity jump bed him ashamed now
142,laziness failed term studies completely University wanted extent protest parents expectations
143,got loan studies
144,met intoxicated people dubious intentions alley Wednesday night
145,TV saw news feature South Africa policeman attacked group black people whip
146,thought read boring book 400 pages English
147,Grovelling people
148,inability assert positively group
149,experience feelings guilt study enough
150,Observing cafeteria noisily gulping food extremely bad manners
151,guess ashamed talked badly people
152,angry unpleasant parents
153,sister  history abortion stillbirth  gave birth perfectly healty boy
154,sister born child emotionally deep down took long time recover
155,starting student project teacher talked negative helpful
156,boyfriend openly let down preferring girl
157,felt disgust boyfriend time left me
158,Cant think any
159,accident aunt offered seat car driver declined took seat killed car crashed
160,Unexpected visit close friend seen half year
161,wandered mistake safety zone shooting range shot at
162,treated unfairly
163,Breaking girl
164,Little contact father died
165,accepted student college thought possible
166,arrive scene accident found close school friend killed
167,accused something got angry
168,grandmother died
169,applicable
170,couple years ago summer holiday fishing lake husband Suddenly started raining sun shining experienced feeling joy happiness fulfillment nature music
171,home bed reading womens magazine storiees paranormal experiences leg itching stretched hand scratch felt strange hand (later realized corner blanket)
172,went lecture cancelled second time negative attitude lecturerá
173,heard superior died later home home reading newspaper thought interaction longer possible limited scope human life sad
174,tram fat sickly looking woman asking directions thick voice got disgusting smell urine came her felt choke
175,home husband I remark done perfectly friendly manner deed unjust knew husband right sense shame
176,remark sister concerning attitude men way talked compared acquaintance mine Later evening sister looked sad felt guilty sadness
177,summer job Sweden boyfriend came meet birthday
178,went practice Sweden summer afraid well
179,holiday cottage association pals came wake early morning bringing radio played highest volume room  morning service loudest
180,grandmother died suddenly summer
181,superior summer job swindled customers could difficult situation detest him
182,arrived hours late work place (a bank) feeling feeble tired
183,association Polish visitors going boat (I chairman association)
184,told unexpectedly wanted vicechairman student organisation surprised joy emotion felt worry  shall succeed 
185,tutorial group soon divided got list names freshmen group read names group went way seminar room wondered cope new situation succeed group leader
186,disco evening pleasant Despite knowing why angry companion let feel bad humour hide feelings
187,grandmother died mother called sunday morning Autumn way mother told it hated moment sounded waiting death grandmother lost person close me felt guilty bad grandmother late remained calm longer understood well
188,underground station drunkard came speak me tried ask answer began speak companion detested dirty growling man
189,worried task related studies groups two talking friends said negative abrupt manner concerning work partner mean said felt ashamed mean criticize friend mine
190,told boyfriend want relationship knew important wanted free saw difficult remained firm change mind
191,night chat fellow student known half year time speaking \the language\ meaning inspiring discussion encounter
192,hearing death grandfather believe it later wept felt situation hopeless felt lonely wanted consolated
193,evening watching TV little brother came started eating food brought kitchen trying concentrate program
194,little brother arrested police railway station drunk beer
195,temporary job restrict others actions obey me gives feeling guilt wish way acting
196,met dear friend long time expressed feelings usual way mutual scolding abusing (with complete understanding) touching patting taking hand person etc
197,felt fear purest kind car accident incident images horror kept coming mind wondered happened sister friend me actually happened
198,boys know telling me indecent manner teased young shy girl know despised conviction scorned touched her got angry try conceal gave them
199,sweetheart left me decided break mutual consent consequences  unrestrained weeping feelings loneliness hopelessness disconsolation felt find friend talk joyfully forget
200,sheer curiosity went pornographic movie Copenhagen room men panted masturbated disgusting
201,quarelled unnecessarily reason stupidly cross way
202,Forced fill questionnaire
203,tennis match
204,dog ran thin ice spring
205,tennis match interrupted kid cycled right court
206,Celebrations graduation day orchestra playing garden ( orchestra)
207,Risk involved fight party
208,heavy work load colleagues against disturbed \terror ringing\ ie continously interrupting telephoning
209,exam failed
210,overtook car mainroad misjudging distance oncoming car resulted tooting flashing driver (we collided) acquaintance car me
211,saw neighbour appartment block me lying road injured ill kept 20 metres away help him
212,met old schhol friend (school love) works Sk+vde
213,cycling school nearly got knocked car (overtook closely) swerving space
214,deputy manager Summer certain deputies took liberties normal
215,realized girlfriend like going separate
216,Dog dirt thaws spring
217,forgot mothers birthday
218,Passed exam
219,nearly knocked car
220,reached bus stop realized forgotten bus pass
221,current work load much feeling comes time time
222,year old son gives spontaneous kiss
223,close travelling car delayed
224,wrong affects negatively
225,think parents getting old
226,time peoples problems motherinlaw depressed time desire strength help
227,excolleague asked interested working accounts bureau needed \clever people\ \immediately thought me\
228,driving deer suddenly appeared car lot traffic me
229,saw report TV news apartheid South Africa
230,girlfriend pregnant
231,nearly collided car
232,time let air tyres cycle
233,read lot remember anything
234,time dog sleep
235,Long illness
236,passed exam
237,travelling tram tripped fell door thought going fall out
238,missed tram run it
239,inability read book college
240,guy interested makes advances
241,drink wine often
242,study understand properly
243,worked lawyers office Summer got good reference him
244,watching triller dark night country outside toilet own
245,accused done unbelievably angry
246,began read thick book limited time read lot work up
247,vomited street
248,think incident felt ashamed small incidents ashamed of instance sending money children Ethiopia
249,lunch exboyfriend mention fiancee felt guilty despite fact felt exboyfriend
250,finally qualified profession
251,attacked knife
252,drove car denied happened
253,told friends wife cancer
254,saw dog knocked car
255,boxed childs ears
256,fined speeding
257,stopped working (had boring job)
258,going home car late night cold dark windy panicky way house
259,Quarrel family
260,room contact  loneliness drains me
261,holiday vomited me
262,Emptied bucket water hospital
263,feigned sick leave work
264,hug love
265,driving fast small road met oncoming car right handed bend driver road skid avoid collision dark
266,car towed away traffic police wrongly parked sign parked
267,operation stay bed long time
268,forced stay canteen eat food asked got anyway
269,buy promised to
270,mistake took book library supposed loaned out
271,unexpected sum money
272,2 year old daughter disappeared moment inattention responsible her
273,colleague asked advice confidence asked person
274,wanted pregnant succeed depressed menstruation
275,warm bus people vomited bus stank
276,complained colleagues behaviour goes word absent irresponsible found alcoholic trying fight againt addiction
277,spoke mother phone skin cancer waiting operated forgot ask date operation finishing conversation gave date passing
278,party met old friend adult education course met 2 years thought lot other wonderful experienceá
279,cycling park late night people jumped woods tried stop me shouting time
280,close relatives tried dissuade studying Psychology low status
281,long discussion politics acquaintance knowledgeable failed explain point view misunderstood felt depressed left
282,read newspaper article young girl raped assaulted night men unconscious
283,mother revealed personal details negative aspects character people present unable defend myself
284,unfaithful partner working abroad long period
285,recently got appartment central Gottenburg
286,saw large spider crawling wall
287,employer took aspirins bad drank enormous spirit dangerous understand wrong
288,left New York family friends me
289,slept guy best friend wanted to intercourse terrible complex it
290,dated close girlfriends boyfriend times told accepted it found finished friendship
291,broke boyfriend years unexpected particular reason break up else
292,son returned mountaineering  healthy body soul
293,meets new people forced collaborate with
294,sports fishermen catch gulls instead fish hooks mistake makes angry
295,feel sad event influence
296,member family complains food served disgusts me
297,recall incident felt shame
298,chosen son private school examination marks low time gives term results left sense guilt
299,informed accepted student Psychology
300,little fishing boat ran hard weather open sea
301,found guy dating particular time steady relationship going long time
302,felt sad depressed heard cat died
303,working nurse mental hospital patient ate contents patients spitoon
304,primary school vomited middle lesson
305,arrived hour late important meeting ( misunderstood time)
306,acceptted student psychology
307,son pain leg (for apparent reason)
308,When week school teacher sent note home saying son inattentive unable lessons
309,thought going impossible start studying (due wrong information student advisor)
310,certain persons lack cleanliness home personally
311,mistake accused of obvious pereson
312,lost valuable sister
313,son born
314,nearly drowned icy water wearing ice skates difficult out
315,pointed problem child primary school mother took teachers point view
316,accused neglecting work wrong reasons
317,parents attitude reconciled despite fathers longtime addiction
318,caught stealing money father
319,stole coconut cake reception table mouth realized host watching me
320,10 months national service \downgraded\ remaining 5 months
321,reprimanded manager hotel worked Autumn 1984
322,parents drove nearby place went home immediately instead waiting hours easily waited
323,exgirlfriend discovered certain risk pregnant
324,clean draining board saw looked underneath sink (I live students hostel)
325,mother caught masturbating
326,person family academics ought looked younger (and only) sister better respect education life experiences
327,older sister told thinking joining rest family winter sports holiday
328,Slept chapel middle night realized someeone chapel discovered there
329,high school guys provoked friend mine called pig grunted irritated girls Once girls got angry friend said nasty terribly angry
330,talked boyfriend phone high spirits lot tell him looking forward conversation listen extent anticipated
331,mother shouts child nothing
332,complained mother untidy kitchen loooked boxed ears ( happened before)
333,home midnight called home 1130 asked leave door open in actually woke family calling late mother sleep conference day needed sleep
334,got day department
335,cycling past parked car opened door nearly pushed bike traffic
336,boyfriend sat half night playing computer games friend
337,leave mother sister weeks visit
338,saw big spider close
339,asked friend return money loaned remembered repayed ways
340,parents insinuates (they divorced)
341,asked childs godmother
342,way ski slope difficult steep
343,mother interfered life
344,left weekend prepared it
345,time saw surgeon cut leg black rubbish bag
346,forgot meeting work
347,demand friends
348,husband suddenly came new job brought flowers cake him
349,nearly attackad man chasing me
350,father asked communist time clear longer daughter
351,applied job thought good chance getting granted interview job
352,TV features showing violation defenceless people
353,child 9 10 playing doctor neighbours boys mother caught us
354,husband talked restrictions accept life marriage work felt directed demanded changes marriage counsellor then
355,able afford new sofa  leather cost SEK 20000 waited 23 years
356,Vertigo  standing ladder painting house
357,boss enrolled course satisfy ends  trample associates misfortune superiors course
358,argue mother way treats children differently
359,Spit vomit
360,Spots seat covers husbands car
361,speaking sisterinlaw lack interest relationship side
362,recently managed consulting assignment \myself\ ie initiative
363,hairs breadth knocking drunkard suddenly ran street fear came later realized happened
364,friend usual forgot tickets home performance missed it
365,elections 1982 1985 thought social democrat communist majority achieve especially \worker share\ funds extension
366,study visit chicken factory : butchery smell environment noise
367,Confession parents involvement moped theft
368,appointed position trust group set change working environment
369,cottage stay in woken rustling sound middle night
370,tried explain plumber face face toilet broken believe (it mended times)
371,result project work treated nonchalantly intead criticized teacher
372,programmes violence pornography shown TV
373,talked maliciously colleague work else Immediately felt ashamed
374,decided week holiday consulting family first
375,girl talked things relationship changed positive diificult time turned pleasant one
376,land plane knew fuel running out Bad weather frightened us
377,read Reagans tactical decision concerning South African boycott
378,half brother seriously ill cancer died later
379,film woman attacked raped worst desired effect  strong
380,comment interpreted completely differently meant said realized mother understood it
381,promised visit girlfriend different reasons it rang later tell come
382,offered high position trust later accepted
383,window open door shut kitten out partner came started talking forgot window suddenly saw kitten hanging window frame rigid fright till got hold her
384,noisy guests arrived hotel slightly irritated earlier night trying sleep party went yelled them wanted sleep early day
385,told successful getting job expecting sure sufficiently qualified
386,cat vomited worm came alive forced wipe up
387,child found taken clothes outdoors summer friend woods felt exciting time parents discovered trousers felt ashamed
388,stole money mother asked later responsible admitted it
389,Cycling spring sunshine gives delight Happiness healthy wonderful finance Simply earth
390,relationship family poor fear excluded group fear stronger situations argument hand
391,Recently sister years younger spoiled shouted mother apparent reason  heartbroken expression mothers face feel angry
392,watched TV programme called \The living planet\ saw far reaching environmental destruction caused man
393,Disgust feeling experienced peoplie  hand repulsive animals ie snakes TV
394,relatives acted strangely unfriendly me
395,due hunger tiredness generally irritated fiancee cutting remarks hurt him Later realized unfounded irritation hurt person love earth
396,boat trip Denmark 14 lot fun spent SEK 10 armed bandits odds jackpot SEK 1000
397,rainy day cycling downhill car door suddenly opened trying avoid wheels bike got caught tram tracks somersaulted injuries
398,way home Marstrand driving fathers car car tried push father forced swerve collided car pillar car drove seeing happened
399,girlfriend spent 6 months abroad broke relationship letter
400,police centre man 4050 brought in drunk likelihood slept indoors long time relieved trousers
401,customer shop worked came asked goods ordered arrived totally forgotten order tried offer weak excuses
402,45 years old hid bicycle keys good friend hours pretended found it
403,endofterm party week fun  happy sang drank soft drinks possible good time alcohol
404,Summer walking beach bikini awful man came cycling me shouting ran fast legs carry me
405,course thought deserved good marks got ordinary marks justification given marks
406,crashed car scrapped then fault feel depressed miss car
407,sort stomach virus week vomited college morning cake shop times trip home got home
408,evening school teacher job coffee able coffee ready time arrived half hour late class coffee undrinkable
409,years ago friend wanted southern Europe preferred travel alone felt guilty wanted own
410,felt love returned
411,convinced someonne broken flat woke heard sounds frightened me
412,clear man people sexually psychologically despite fact people looked him understood trust forced hide while
413,feel helpless tried help result
414,think way father behaved filing divorce
